{
  "name": "UI & Rendering",
  "description": "The viewer component, graph operations, and Cytoscape rendering pipeline.",
  "edges": [
    ["main", "viewer", "mounts"],
    ["lib", "viewer", "mounts"],
    ["viewer", "graph-decode", "fetches and decodes"],
    ["viewer", "graph-build", "constructs graph"],
    ["viewer", "graph-operations", "filters by depth"],
    ["viewer", "graph-cytoscape", "converts for rendering"],
    ["viewer", "graph-search", "searches"],
    ["viewer", "ffi-cytoscape", "renders via"],
    ["viewer", "tutorial", "loads tours"],
    ["viewer", "prompt-builder", "assembles prompts"],
    ["viewer", "halogen", "built with"],
    ["main", "halogen", "built with"],
    ["ffi-cytoscape", "cytoscape-js", "wraps"],
    ["graph-decode", "graph-types", "produces"],
    ["graph-build", "graph-types", "consumes and produces"],
    ["graph-operations", "graph-types", "operates on"],
    ["graph-search", "graph-types", "searches over"],
    ["graph-cytoscape", "graph-types", "reads"],
    ["depth-filtering", "graph-operations", "implemented by"],
    ["viewer", "depth-filtering", "exposes via controls"]
  ],
  "tours": [
    {
      "id": "rendering-pipeline",
      "title": "How the Graph Renders",
      "description": "From JSON to pixels: the rendering pipeline.",
      "stops": [
        {
          "node": "viewer",
          "depth": 1,
          "title": "The Viewer Component",
          "narrative": "The [Viewer](node:viewer) is the central Halogen component. It manages all state: selected node, hover, search, tutorials, and depth controls."
        },
        {
          "node": "graph-decode",
          "depth": 1,
          "title": "Decoding Graph Data",
          "narrative": "[Graph.Decode](node:graph-decode) parses JSON into typed PureScript records, producing the [Graph.Types](node:graph-types) structures."
        },
        {
          "node": "ffi-cytoscape",
          "depth": 1,
          "title": "Cytoscape FFI",
          "narrative": "The [FFI wrapper](node:ffi-cytoscape) is a thin JS interop layer around [Cytoscape.js](node:cytoscape-js). No business logic — just rendering calls."
        }
      ]
    }
  ]
}
