{
  "name": "Build & Validation",
  "description": "Nix build system, schemas, and CI validation pipeline.",
  "edges": [
    ["nix-flake", "spago", "invokes"],
    ["nix-flake", "esbuild", "invokes"],
    ["nix-flake", "app-output", "produces"],
    ["nix-flake", "lib-output", "produces"],
    ["lib-output", "data-driven", "enables"],
    ["schema-graph", "graph-types", "documents"],
    ["schema-config", "graph-types", "documents"],
    ["schema-tutorial", "tutorial", "documents"],
    ["validate-workflow", "schema-graph", "validates against"],
    ["validate-workflow", "schema-config", "validates against"],
    ["validate-workflow", "schema-tutorial", "validates against"],
    ["schema-view", "graph-views", "documents"],
    ["validate-action", "schema-view", "validates against"],
    ["validate-action", "schema-graph", "validates against"],
    ["validate-action", "schema-config", "validates against"],
    ["validate-action", "schema-tutorial", "validates against"],
    ["build-action", "lib-output", "downloads"],
    ["build-action", "data-driven", "leverages"]
  ],
  "tours": [
    {
      "id": "build-pipeline",
      "title": "How the Build Works",
      "description": "From source to deployable output via Nix.",
      "stops": [
        {
          "node": "nix-flake",
          "depth": 1,
          "title": "The Nix Flake",
          "narrative": "The [flake](node:nix-flake) orchestrates the entire build. It invokes [Spago](node:spago) for PureScript and [esbuild](node:esbuild) for JS bundling."
        },
        {
          "node": "validate-workflow",
          "depth": 1,
          "title": "CI Validation",
          "narrative": "The [validate workflow](node:validate-workflow) checks data against JSON schemas — [graph](node:schema-graph), [config](node:schema-config), and [tutorial](node:schema-tutorial) schemas."
        }
      ]
    }
  ]
}
